<?xml version='1.0' encoding='UTF-8'?>
<!DOCTYPE dataset SYSTEM "src/test/resources/dataset/interview-it.dtd">
<dataset>
    <USERS ID="10" NAME="Name" PASSWORD="5f4dcc3b5aa765d61d8327deb882cf99" EMAIL="email@mail.com"/>
    <TECHNOLOGIES ID="1" TECHNOLOGYNAME="APL"/>
    <TECHNOLOGIES ID="2" TECHNOLOGYNAME="C"/>
    <TECHNOLOGIES ID="3" TECHNOLOGYNAME="C#/.NET"/>
    <POSITIONS ID="1" POSITIONGROUP="Development" POSITIONNAME="Junior Software Engineer"/>
    <POSITIONS ID="2" POSITIONGROUP="  Development" POSITIONNAME="Software Engineer"/>
    <POSITIONS ID="3" POSITIONGROUP="Development" POSITIONNAME="Senior Software Engineer"/>
    <COMPANY ID="1" COMPANYNAME="COMPANY1"/>
    <COMPANY ID="2" COMPANYNAME="COMPANY2"/>
    <COMPANY ID="3" COMPANYNAME="COMPANY3"/>
    <CITY ID="1" CITYNAME="CITY1"/>
    <CITY ID="2" CITYNAME="CITY2"/>
    <CITY ID="3" CITYNAME="CITY3"/>
    <INTERVIEW ID="1" USERID="10" COMPANY_ID="1" TECHNOLOGY_ID="1" POSITION_ID="1"  CITY_ID="1" FEEDBACK="FEEDBACK 1"  />
    <INTERVIEW ID="2" USERID="10" COMPANY_ID="2" TECHNOLOGY_ID="2" POSITION_ID="2"  CITY_ID="2" FEEDBACK="FEEDBACK 2"/>
    <INTERVIEW ID="3" USERID="10" COMPANY_ID="3" TECHNOLOGY_ID="3" POSITION_ID="3"  CITY_ID="3" FEEDBACK="FEEDBACK 3" />
</dataset>
